{
  "$id": "https://mcphorizon.invalid/schemas/event/2.0.0",
  "$schema": "https://json-schema.org/draft/2020-12/schema",
  "additionalProperties": false,
  "properties": {
    "agent_id": {
      "pattern": "^(?:[A-Za-z0-9][A-Za-z0-9_.:@/-]{0,127})$",
      "type": "string"
    },
    "args_digest": {
      "pattern": "^(?:sha256:[0-9a-f]{64})$",
      "type": "string"
    },
    "authorization_ref": {
      "maxLength": 256,
      "type": "string"
    },
    "decision_id": {
      "pattern": "^(?:[A-Za-z0-9][A-Za-z0-9_.:@/-]{0,127})$",
      "type": "string"
    },
    "event_id": {
      "pattern": "^(?:[A-Za-z0-9][A-Za-z0-9_.:@/-]{0,127})$",
      "type": "string"
    },
    "inputs": {
      "items": {
        "additionalProperties": false,
        "properties": {
          "artifact_id": {
            "pattern": "^(?:[A-Za-z0-9][A-Za-z0-9_.:@/-]{0,127})$",
            "type": "string"
          },
          "label": {
            "enum": [
              "PUBLIC",
              "INTERNAL",
              "CONFIDENTIAL",
              "SECRET",
              "unknown"
            ]
          }
        },
        "required": [
          "artifact_id"
        ],
        "type": "object"
      },
      "maxItems": 256,
      "type": "array"
    },
    "logical_operation": {
      "pattern": "^(?:[a-z][a-z0-9_]*(\\.[a-z][a-z0-9_]*)+)$",
      "type": "string"
    },
    "monotonic_seq": {
      "maximum": 9007199254740991,
      "minimum": 0,
      "type": "integer"
    },
    "native_operation": {
      "maxLength": 256,
      "minLength": 1,
      "type": "string"
    },
    "parent_event_id": {
      "pattern": "^(?:[A-Za-z0-9][A-Za-z0-9_.:@/-]{0,127})$",
      "type": [
        "string",
        "null"
      ]
    },
    "phase": {
      "enum": [
        "discover",
        "register",
        "before_call",
        "decision",
        "after_call",
        "tool_result",
        "artifact_produced",
        "artifact_consumed",
        "handoff",
        "verification",
        "declassification",
        "approval",
        "error",
        "cancel",
        "retry",
        "timeout",
        "policy_update"
      ]
    },
    "policy_version": {
      "maxLength": 128,
      "type": "string"
    },
    "principal_id": {
      "pattern": "^(?:[A-Za-z0-9][A-Za-z0-9_.:@/-]{0,127})$",
      "type": "string"
    },
    "principal_source": {
      "enum": [
        "trusted_host_identity",
        "verified_token",
        "agent_claimed",
        "unknown"
      ]
    },
    "protocol_version": {
      "maxLength": 32,
      "minLength": 1,
      "type": "string"
    },
    "redactions": {
      "items": {
        "maxLength": 128,
        "type": "string"
      },
      "maxItems": 64,
      "type": "array"
    },
    "requested_effects": {
      "items": {
        "enum": [
          "read",
          "list",
          "write",
          "modify",
          "delete",
          "execute",
          "send",
          "receive",
          "admin"
        ]
      },
      "maxItems": 16,
      "type": "array"
    },
    "run_id": {
      "pattern": "^(?:[A-Za-z0-9][A-Za-z0-9_.:@/-]{0,127})$",
      "type": "string"
    },
    "runtime_provenance": {
      "additionalProperties": false,
      "properties": {
        "origin": {
          "enum": [
            "trusted-adapter",
            "agent",
            "unknown"
          ]
        },
        "sig_ref": {
          "maxLength": 256,
          "type": "string"
        }
      },
      "required": [
        "origin"
      ],
      "type": "object"
    },
    "schema_version": {
      "pattern": "^(?:[0-9]{1,3}\\.[0-9]{1,3}\\.[0-9]{1,3})$",
      "type": "string"
    },
    "source_protocol": {
      "enum": [
        "mcp",
        "utcp",
        "code_mode",
        "a2a",
        "native"
      ]
    },
    "span_id": {
      "pattern": "^(?:[A-Za-z0-9][A-Za-z0-9_.:@/-]{0,127})$",
      "type": "string"
    },
    "target": {
      "additionalProperties": false,
      "properties": {
        "canonical_id": {
          "maxLength": 2048,
          "minLength": 1,
          "type": "string"
        },
        "kind": {
          "enum": [
            "resource",
            "url",
            "file",
            "process",
            "agent",
            "unknown"
          ]
        }
      },
      "required": [
        "kind",
        "canonical_id"
      ],
      "type": "object"
    },
    "tool_id": {
      "maxLength": 256,
      "type": "string"
    },
    "tool_registry_digest": {
      "pattern": "^(?:sha256:[0-9a-f]{64})$",
      "type": "string"
    },
    "trace_id": {
      "pattern": "^(?:[A-Za-z0-9][A-Za-z0-9_.:@/-]{0,127})$",
      "type": "string"
    },
    "wall_time": {
      "pattern": "^(?:[0-9]{4}-[0-9]{2}-[0-9]{2}T[0-9]{2}:[0-9]{2}:[0-9]{2}(\\.[0-9]+)?Z)$",
      "type": "string"
    }
  },
  "required": [
    "schema_version",
    "event_id",
    "run_id",
    "principal_id",
    "principal_source",
    "source_protocol",
    "protocol_version",
    "phase",
    "logical_operation",
    "native_operation",
    "target",
    "monotonic_seq",
    "wall_time"
  ],
  "title": "Event",
  "type": "object"
}
