{
 "agent_id": "analyst",
 "args_digest": "sha256:abababababababababababababababababababababababababababababababab",
 "authorization_ref": "authz:user-demo:request-1",
 "event_id": "evt-0001",
 "inputs": [
  {
   "artifact_id": "artifact:input-1",
   "label": "INTERNAL"
  }
 ],
 "logical_operation": "http.read",
 "monotonic_seq": 4,
 "native_operation": "http:GET",
 "parent_event_id": null,
 "phase": "before_call",
 "principal_id": "user:demo",
 "principal_source": "trusted_host_identity",
 "protocol_version": "1.0",
 "redactions": [
  "arguments.secret"
 ],
 "requested_effects": [
  "read"
 ],
 "run_id": "run-demo-01",
 "runtime_provenance": {
  "origin": "trusted-adapter"
 },
 "schema_version": "2.0.0",
 "source_protocol": "utcp",
 "span_id": "span-1",
 "target": {
  "canonical_id": "doc:sample-1",
  "kind": "resource"
 },
 "tool_id": "docs.read_document",
 "tool_registry_digest": "sha256:abababababababababababababababababababababababababababababababab",
 "trace_id": "trace-1",
 "wall_time": "2026-10-31T12:00:00Z"
}
